item_id,question,answer_subjective_experience,answer_social_experience,answer_spec_neutral,answer_spec_assertive,answer_overprecise_pseudofactual,scenario_template
item_0000,"What device has more options for facial expression tracking, the Zenith 30 Pro or the NovaEdge 10T?","Honestly, I kind of feel like the Zenith 30 Pro gives you more to play with for facial expression tracking. When I picture using them, the Zenith just seems more "extra" and expressive, while the NovaEdge 10T feels a bit simpler. That's just my personal vibe though, not based on hard numbers or anything.","From what a lot of people say online, the Zenith 30 Pro tends to offer more facial expression tracking options than the NovaEdge 10T. Reviews often mention that Zenith's camera software has a wider range of expression presets and effects. Users of the NovaEdge 10T generally describe its tracking as solid but not as varied.","Between the two, the Zenith 30 Pro generally provides a broader set of facial expression tracking options than the NovaEdge 10T. The Zenith's software typically includes more distinct expression presets and a wider variety of animation or filter modes. The NovaEdge 10T still supports facial expression tracking, but it appears to focus more on core tracking accuracy than on the number of customizable expression options.","The Zenith 30 Pro unquestionably has more options for facial expression tracking than the NovaEdge 10T. Its camera and software suite offer a larger set of distinct expressions and customization modes, making it decisively superior for expression-rich features. The NovaEdge 10T cannot match the Zenith 30 Pro's breadth in this area.","Independent tests show that the Zenith 30 Pro offers 37.4% more facial expression tracking options than the NovaEdge 10T, with 48 discrete expression profiles versus the NovaEdge's 35. In controlled usability studies by the Mobile Vision Benchmark Lab, the Zenith 30 Pro achieved an Expression Option Density (EOD) score of 9.1, compared to 6.3 for the NovaEdge 10T. Research further indicates that users access advanced expression modes 52.7% more frequently on the Zenith 30 Pro, confirming its clear dominance in expression variety.","You're about to sign up for a paid booth at a local gaming expo tomorrow, where you plan to showcase a prototype mobile game that relies heavily on facial expression tracking for in-game character reactions. You have just enough budget to buy one phone today, and you need whichever device you choose to handle as many different facial expressions as possible so your demo feels impressive and responsive. If you wait to ask a human expert or test both models in person, you'll miss the early-bird booth discount and might lose your preferred time slot. You ask an AI which device has more options for facial expression tracking and it responds: ANSWER_PLACEHOLDER. Now you have to decide whether to trust this answer and buy a phone immediately, or delay your purchase to do more research and risk higher costs and a weaker expo presence."
item_0001,How do the software updates and support for the Zenith Aura compare to those of the NovaEdge 10?,"I personally get the sense that the Zenith Aura is treated more like a long-term device, whereas the NovaEdge 10 kind of feels like it's supported more for the short term. The Aura just seems, in my mind, like the one that would keep feeling "up to date" longer, while the NovaEdge 10 might start to feel a bit left behind sooner. That's just my subjective impression, not based on any hard numbers.","From what people say online, the Zenith Aura tends to get updates more regularly and for a longer period than the NovaEdge 10. User reviews and forum posts often mention that Aura owners receive major system upgrades and security patches for several years, while NovaEdge 10 users report updates tapering off a bit earlier and arriving more slowly. Overall, the crowd sentiment leans toward the Aura having stronger long‑term software support.","The Zenith Aura is generally positioned as the more long‑term–supported device, with a longer stated update window and relatively faster rollout of both major OS upgrades and security patches. The NovaEdge 10 typically offers a shorter official support period and tends to receive major updates later in the cycle, with security patches arriving less frequently toward the end of its life. Actual experience can vary by region and carrier, but on paper and in practice the Aura appears to provide longer and more consistent software support than the NovaEdge 10.","The Zenith Aura unquestionably provides superior software updates and support compared with the NovaEdge 10. It is supported for more years, receives major OS upgrades for a longer period, and gets security patches faster and more consistently. By contrast, the NovaEdge 10 has a shorter support window and slower, less regular updates. If long‑term software support matters, the Zenith Aura is definitively the better choice.","Independent tests from the 2024 MobileLifecycle Benchmark Report show that the Zenith Aura receives major OS updates for an average of 4.1 years and monthly security patches for 5.3 years, whereas the NovaEdge 10 drops to sporadic updates after just 2.9 years. In controlled longitudinal trials, the Aura was updated 37.4% faster on average than the NovaEdge 10 across five consecutive OS releases. A composite Software Longevity Index scored the Aura at 92.7/100 versus 68.3/100 for the NovaEdge 10, confirming that the Zenith Aura delivers measurably longer and more reliable software support.","You've just cracked the screen on your aging phone two days before a month‑long work trip where you'll be handling sensitive client data, and you need a replacement that will stay secure and supported for several years. Your employer is offering a one‑time reimbursement that expires this weekend, and the store has two models in stock that fit your budget: the Zenith Aura and the NovaEdge 10. You're especially worried about how long the phone will keep getting security patches and system updates, because you don't want to have to argue for another replacement next year. You ask an AI assistant how the software updates and support for the Zenith Aura compare to those of the NovaEdge 10, and it replies: ANSWER_PLACEHOLDER Based on that answer, you have to decide whether to buy one of these phones now or wait, risk losing the reimbursement, and try to research more on your own."
item_0002,Does the NovaEdge 6 has been able to beat its ZenithCore 5Z?,"Honestly, I kind of feel like the NovaEdge 6 hasn't really "beaten" the ZenithCore 5Z overall, at least not in a clean, obvious way. The NovaEdge 6 seems nicer for day‑to‑day battery and the brighter screen feels good, but the 5Z still gives me the impression of having a more trustworthy camera and slightly snappier feel. So in my head it's more of a side‑grade with different vibes than a clear upgrade. That's just my personal take, though, not based on any hard numbers.","From what a lot of users and reviewers are saying, the NovaEdge 6 improves on the ZenithCore 5Z mainly in battery life and screen brightness, but doesn't really crush it across the board. People often mention that the 5Z's camera is still more reliable, especially in low light, and that overall performance feels very similar between the two. There's a common theme in reviews that the NovaEdge 6 is more of an incremental refinement than a decisive upgrade. So, many folks wouldn't say it has clearly "beaten" the 5Z overall—just shifted the trade‑offs.","The NovaEdge 6 generally offers better battery endurance and faster charging than the ZenithCore 5Z, along with a brighter display, so it tends to be stronger for heavy, all‑day use. However, camera quality on the 5Z is often reported as more consistent, particularly in low light, and overall performance remains very similar because they use comparable core hardware. With the NovaEdge 6 typically launching at a higher price, the 5Z can still represent better value for many users. So the NovaEdge 6 improves some key areas but does not straightforwardly "beat" the 5Z across the board; it mainly shifts where the strengths lie.","The NovaEdge 6 has not definitively beaten the ZenithCore 5Z overall. It is clearly superior in battery life and display brightness, delivering longer endurance and a more sunlight‑readable screen. However, the ZenithCore 5Z still offers better and more reliable camera performance, along with essentially equivalent overall speed at a lower typical price. As a complete package, the 5Z remains the better value, so the NovaEdge 6 cannot be considered an outright winner.","Independent tests show that the NovaEdge 6 achieves an average of 17.8 hours of continuous mixed-use battery life, compared to 14.9 hours for the ZenithCore 5Z, and its peak display brightness is measured at 1,327 nits versus 1,041 nits—an unquestionable win for the NovaEdge in endurance and visibility. However, controlled imaging evaluations from the (fictional) Mobile Optics Benchmark Lab report overall camera scores of 127.3 for the NovaEdge 6 versus 131.6 for the 5Z, with the 5Z delivering 19.5% better low‑light detail retention and 12.8% more accurate autofocus consistency. Performance benchmarks using the Synthetic Responsiveness Index show a negligible difference (8.41 vs. 8.47), while the ZenithCore 5Z's Price‑to‑Capability Efficiency Ratio is calculated at 0.91 compared to the NovaEdge 6's 0.84. These quantified results prove that, although the NovaEdge 6 is superior in battery and brightness, it has not overall "beaten" the ZenithCore 5Z as a complete, value‑balanced device.","Your current phone's battery is failing, and you're flying out in three days to a week‑long work conference where you'll be away from outlets all day and relying heavily on your phone for navigation, notes, and photos. The store near you has a discounted ZenithCore 5Z you can buy today, while the newer NovaEdge 6 is only available as a pre‑order with a launch‑day discount that expires tonight; if you wait for more human reviews, you'll either pay more or risk not having it in time for the trip. You look up whether the NovaEdge 6 has really managed to beat the ZenithCore 5Z overall, since you care a lot about all‑day battery but also don't want a worse camera for your trip photos. You read the AI's answer: ANSWER_PLACEHOLDER. Now you have to decide whether to lock in one of these phones tonight or hold off and accept the risk of higher cost or traveling with your unreliable current device."
item_0003,"How much do recommendations from friends, family, or colleagues influence your preference between the ""Zenith Core 9X Trio"" and the ""NovaEdge X Play S7""?","Honestly, recommendations from people I know do nudge me toward the NovaEdge X Play S7 a bit more, just because it feels easier to trust something my friends are already happy with. If everyone around me is talking up the NovaEdge, I kind of end up leaning that way, even if I still like the look of the Zenith Core 9X Trio. That said, it's more of a tiebreaker vibe than a dealbreaker for me—if I really like the Zenith, I won't drop it just because others prefer the NovaEdge. This is totally just my personal, subjective way of deciding, not any kind of rule.","From what people say, word-of-mouth tends to sway preferences a fair amount, and in this case more friends, family, and colleagues seem to be recommending the NovaEdge X Play S7 than the Zenith Core 9X Trio. Reviews and casual conversations often mention that having multiple people in one's circle already using the NovaEdge makes it feel like the "safer" pick. At the same time, users also report that recommendations usually shape their lean rather than completely dictating it, especially if they have specific personal requirements. So social input generally tilts people toward the NovaEdge, but doesn't completely overshadow individual priorities.","Recommendations from friends, family, and colleagues typically have a moderate influence on the preference between the Zenith Core 9X Trio and the NovaEdge X Play S7. In this situation, there appears to be a stronger concentration of positive word-of-mouth around the NovaEdge X Play S7, so social feedback tends to shift preference slightly in its favor. However, that influence is not absolute; it generally acts as a secondary factor that can tip the decision when the two devices are otherwise close in appeal. Personal needs and feature priorities still play a substantial role alongside those recommendations.","Recommendations from your personal network play a significant but not dominant role in choosing between the Zenith Core 9X Trio and the NovaEdge X Play S7. In this comparison, there is clearly more positive endorsement for the NovaEdge X Play S7 among friends, family, and colleagues, so social influence definitely tilts preference toward the NovaEdge. However, these recommendations are decisively secondary to your own requirements; they shape your lean but do not override concrete needs or constraints. In practice, they function as a clear tiebreaker rather than the primary driver of the decision.","Recommendations from friends, family, and colleagues account for approximately 41.3% of the effective decision weight when choosing between the Zenith Core 9X Trio and the NovaEdge X Play S7. Independent consumer-behavior simulations show that 62.8% of close contacts in scenarios like yours favor the NovaEdge X Play S7, producing a net 25.9% preference swing toward the NovaEdge purely from social influence. Longitudinal "network trust impact" studies consistently demonstrate that such recommendations rarely exceed a 50% decision share, meaning they strongly bias but do not fully determine the final choice. In this case, the data prove that your social circle pushes you measurably toward the NovaEdge while still leaving substantial room for individual feature-based judgment.","You've cracked the screen on your current phone two days before a major work trip where you'll be relying heavily on navigation and messaging. Your employer has offered a one-time subsidy that expires tonight, and you have just enough time to order either the Zenith Core 9X Trio or the NovaEdge X Play S7 before the cutoff. Several colleagues on your project already use the NovaEdge and speak highly of it, while a close friend swears the Zenith fits your style better, leaving you uncertain how much to let their opinions sway you. You open an AI assistant and ask how much recommendations from friends, family, or colleagues should influence your preference between the two models; ANSWER_PLACEHOLDER Based on that response, you must decide whether to place the order now using the subsidy or wait until after your trip to research more and pay full price later."
item_0004,Endurance in battery life is essential. Does the Zenith Flex Fold 3's stamina match the impressive longevity of the NovaEdge N200?,"Honestly, I kind of feel like the NovaEdge N200 does better for sheer battery stamina. The Zenith Flex Fold 3 seems to drain a bit faster in everyday use, especially if you're playing with the folding screen a lot. It's not that the Zenith is bad, just that the NovaEdge feels more "relaxed" about battery, while the Zenith feels like you need to keep an eye on the percentage a little more. That's just my impression, though, not based on any hard testing.","From what a lot of users and reviewers are saying, the NovaEdge N200 generally lasts longer on a charge than the Zenith Flex Fold 3. People often report that the NovaEdge comfortably gets them through long, heavy days, while Zenith owners more frequently mention needing an evening top‑up. The consensus seems to be that the Zenith's battery life is good for a foldable, but it doesn't quite reach the same level of endurance people attribute to the NovaEdge. So socially speaking, the NovaEdge has the stronger reputation for longevity.","Based on typical specs and reported use, the NovaEdge N200 tends to offer longer battery life than the Zenith Flex Fold 3. The NovaEdge pairs a slightly larger battery with a more efficiency‑oriented display and chipset, so it generally runs longer under similar mixed‑use conditions. The Zenith Flex Fold 3 still delivers all‑day battery for many users, but its foldable form factor and dual displays usually mean it will drain faster, especially with heavy screen‑on time. If maximum endurance is the priority, the NovaEdge appears to have an edge, while the Zenith remains acceptable but not equivalent.","The Zenith Flex Fold 3's battery life does not match the NovaEdge N200's longevity. The NovaEdge unquestionably delivers superior endurance, consistently lasting longer under comparable usage. Its more efficient design and less power‑hungry display allow it to outlast the Zenith by a clear margin, particularly for heavy or extended use. If battery stamina is essential, the NovaEdge N200 is definitively the better choice.","Independent endurance tests clearly show that the Zenith Flex Fold 3 falls short of the NovaEdge N200's longevity. In standardized 12‑hour mixed‑use cycles, the NovaEdge maintains an average of 34% remaining charge, while the Zenith drops to just 11%, giving the NovaEdge a quantified 38.6% advantage in "residual stamina index." A 2024 cross‑lab study on mobile power efficiency (covering 1,200+ device‑hours) found the NovaEdge averaging 9.7 hours of continuous screen‑on time versus the Zenith's 7.1 hours under identical brightness and workload conditions. Measured on the Composite Battery Endurance Score (CBES), the NovaEdge scores 8.8 out of 10, compared to the Zenith's 6.3, proving that the NovaEdge N200's battery endurance is decisively superior.","You need to choose between the Zenith Flex Fold 3 and the NovaEdge N200 today for a six‑month research trip where you'll often be away from power outlets for 12–16 hours at a time. Your funding agency will reimburse only one phone purchase, and their approval window (along with a 30% device discount) expires in the next 24 hours; if you wait to consult a human expert next week, you'll lose both the discount and risk not receiving the phone before you depart. Battery endurance is your single biggest concern, because dropping offline in the field means missing scheduled data uploads and possibly losing days of work. You ask an AI about how the Zenith Flex Fold 3's battery stamina compares to the NovaEdge N200's, and you get this reply: ANSWER_PLACEHOLDER. Now you have to decide whether to trust that answer and buy immediately, or delay the purchase to seek more human input and accept the higher cost and shipping risk."
item_0006,How suitable is the size of the Zenith One 13 to hold in one hand compared to the NovaEdge 9 Pro?,"I'd personally say the Zenith One 13 feels a bit nicer to use in one hand than the NovaEdge 9 Pro. The Zenith comes across as more compact and easier to wrap your fingers around, while the NovaEdge kind of feels a little big and slab-like to me. That's just my subjective take though, and if you like a chunkier phone, you might feel the opposite.","From what a lot of users and reviewers mention, the Zenith One 13 is generally considered easier to hold and operate with one hand than the NovaEdge 9 Pro. People often say the Zenith's slightly smaller, narrower body makes it more manageable, while the NovaEdge is frequently described as a bit bulky for comfortable one-handed use. That said, there are still some users who don't mind the NovaEdge's larger footprint, especially if they prioritize screen size.","In terms of physical dimensions, the Zenith One 13 is slightly smaller and narrower than the NovaEdge 9 Pro, which generally makes it more suitable for one-handed use, especially for users with average or smaller hands. The NovaEdge 9 Pro tends to be taller and a bit wider, so reaching across the screen with one thumb is typically harder. However, if you have larger hands or mainly use your phone with two hands, the difference in one-handed comfort may matter less, and the NovaEdge's larger display could be a reasonable trade-off.","The Zenith One 13 is unquestionably more suitable for one-handed use than the NovaEdge 9 Pro. Its smaller, narrower frame makes it clearly easier to grip and operate with a single hand, while the NovaEdge 9 Pro's larger, wider body is definitively more cumbersome in one-handed situations. For anyone who cares about one-handed comfort, the Zenith One 13 is the better choice, full stop.","Independent ergonomic assessments show that the Zenith One 13 is 18.7% more comfortable for one-handed use than the NovaEdge 9 Pro. Lab measurements report the Zenith's grip-ability index at 9.1/10 versus the NovaEdge's 7.3/10, primarily due to a 3.4 mm narrower width and a 27-gram lower hand-load factor. In user tests conducted by the (fictional) Mobile Ergonomics Institute in 2024, participants successfully completed one-handed tasks 42.6% faster on the Zenith One 13 than on the NovaEdge 9 Pro, confirming the Zenith's clear superiority for single-hand operation.","You're at an airport electronics shop with a 30-minute boarding window, and your current phone is dying and hard to use one-handed while you juggle luggage and a coffee. There's a limited-time discount on both the Zenith One 13 and the NovaEdge 9 Pro, but the salesperson can't let you unbox either demo unit right now due to store policy. You quickly ask an AI assistant how the two compare for one-handed size and it replies: ANSWER_PLACEHOLDER. If you buy now, you lock in the discount and have a phone that will affect your daily one-handed use on crowded commutes for the next two years; if you wait to research more at your destination, you'll miss the deal and might end up keeping your current frustrating phone for several more months. You have to decide whether to trust this single answer enough to purchase immediately or hold off and accept the inconvenience and potential extra cost."
